{"artifact_text":"(set-logic QF_UF)\n(check-sat)\n","compilation_map":[{"ckc_node_id":"rule_sepsis_bl_recommend","source_span_ids":["span_rec_sepsis_bl"],"target_symbol":"recommend_administer_beta_lactam"},{"ckc_node_id":"rule_bl_anaphylaxis_contra","source_span_ids":["span_contra_bl_allergy","span_allergy_history"],"target_symbol":"prohibit_administer_beta_lactam"}],"diagnostics":[{"code":"ckc_compile_norm_conflict","message_en":"Recommendation and contraindication conflict without priority","message_ja":"推奨と禁忌が優先順位なしで衝突します","source_span_ids":["span_rec_sepsis_bl","span_contra_bl_allergy"]}],"replay_command":"z3 -smt2 logic/smt/norm_conflict.smt2","source_artifact_hashes":["sha256:a0b1c2d3e4f5a0b1c2d3e4f5a0b1c2d3e4f5a0b1c2d3e4f5a0b1c2d3e4f5a0b1"],"target_language":"smt_lib","target_parse_ok":true}